author,text,timestamp
GamerPro123,This is great! But I always feel anxious after watching these videos. Like I'm not doing enough.,2024-05-18T10:00:00Z
StudyBug88,I buy all these courses but finish none. How do I actually start?,2024-05-18T11:30:00Z
LifeHacker42,"So much advice, so little time. Feels like I'm just busy, not productive.",2024-05-18T12:45:00Z
CreativeSoul99,They make it look so easy. I wish they showed the messy parts too.,2024-05-18T14:00:00Z
RealistReader,"Love the tips, but these videos often make me feel inadequate. Need more practical steps.",2024-05-18T15:15:00Z
MotivatedMinds,"This is inspiring, but I still struggle with the 'doing' part. Where's the bridge?",2024-05-18T16:30:00Z
ProductivitySeeker,Always the same advice. Need something that addresses the *why* behind the struggle.,2024-05-18T17:45:00Z
DigitalDetoxDude,Feeling overwhelmed by all the 'hacks'. Need simplicity.,2024-05-18T19:00:00Z
StudentStruggles,I feel like I'm just watching videos instead of doing the work!,2024-05-18T20:15:00Z
GoalGetter,How to bridge the gap between inspiration and execution? That's the real question.,2024-05-18T21:30:00Z
